{
  "certification_evidence_exact_percent": 0.0,
  "certification_required": 21,
  "certification_satisfied": 0,
  "controls": [
    {
      "certification_path": "release-gate rust-quality/windows",
      "current_runner_notes": null,
      "current_runner_status": null,
      "effective_status": "pending",
      "id": "rust-windows",
      "notes": "",
      "overall_gain_if_next_valid_pass": 0.0522,
      "p30_gain_if_next_valid_pass": 1.619,
      "raw_status": "pending",
      "recorded_at": null,
      "requirement": "Windows + cargo/rustc",
      "title": "Windows Rust quality/build"
    },
    {
      "certification_path": "release-gate rust-quality/linux",
      "current_runner_notes": null,
      "current_runner_status": null,
      "effective_status": "pending",
      "id": "rust-linux",
      "notes": "",
      "overall_gain_if_next_valid_pass": 0.0522,
      "p30_gain_if_next_valid_pass": 1.619,
      "raw_status": "pending",
      "recorded_at": null,
      "requirement": "Linux + cargo/rustc",
      "title": "Linux Rust quality/build"
    },
    {
      "certification_path": "release-gate rust-quality/macos",
      "current_runner_notes": null,
      "current_runner_status": null,
      "effective_status": "pending",
      "id": "rust-macos",
      "notes": "",
      "overall_gain_if_next_valid_pass": 0.0522,
      "p30_gain_if_next_valid_pass": 1.619,
      "raw_status": "pending",
      "recorded_at": null,
      "requirement": "macOS + cargo/rustc",
      "title": "macOS Rust quality/build"
    },
    {
      "certification_path": "release-gate frontends",
      "current_runner_notes": null,
      "current_runner_status": null,
      "effective_status": "pending",
      "id": "desktop-build",
      "notes": "",
      "overall_gain_if_next_valid_pass": 0.0522,
      "p30_gain_if_next_valid_pass": 1.619,
      "raw_status": "pending",
      "recorded_at": null,
      "requirement": "Node/npm + installed dependencies",
      "title": "Desktop production bundle"
    },
    {
      "certification_path": "release-gate frontends",
      "current_runner_notes": null,
      "current_runner_status": null,
      "effective_status": "pending",
      "id": "dashboard-build",
      "notes": "",
      "overall_gain_if_next_valid_pass": 0.0522,
      "p30_gain_if_next_valid_pass": 1.619,
      "raw_status": "pending",
      "recorded_at": null,
      "requirement": "Node/npm + installed dependencies",
      "title": "Dashboard production bundle"
    },
    {
      "certification_path": "release-gate windows-msi",
      "current_runner_notes": null,
      "current_runner_status": null,
      "effective_status": "pending",
      "id": "msi-install-uninstall",
      "notes": "",
      "overall_gain_if_next_valid_pass": 0.0522,
      "p30_gain_if_next_valid_pass": 1.619,
      "raw_status": "pending",
      "recorded_at": null,
      "requirement": "Windows + compiled binaries + WiX",
      "title": "Windows MSI acceptance"
    },
    {
      "certification_path": "release-gate linux-deb",
      "current_runner_notes": null,
      "current_runner_status": null,
      "effective_status": "pending",
      "id": "deb-install-uninstall",
      "notes": "",
      "overall_gain_if_next_valid_pass": 0.0522,
      "p30_gain_if_next_valid_pass": 1.619,
      "raw_status": "pending",
      "recorded_at": null,
      "requirement": "Linux root + compiled binaries + dpkg",
      "title": "Linux deb acceptance"
    },
    {
      "certification_path": "release-gate macos-pkg",
      "current_runner_notes": null,
      "current_runner_status": null,
      "effective_status": "pending",
      "id": "pkg-install-uninstall",
      "notes": "",
      "overall_gain_if_next_valid_pass": 0.0522,
      "p30_gain_if_next_valid_pass": 1.619,
      "raw_status": "pending",
      "recorded_at": null,
      "requirement": "macOS + compiled binaries + pkg tools",
      "title": "macOS pkg acceptance"
    },
    {
      "certification_path": "release-gate rust-quality",
      "current_runner_notes": null,
      "current_runner_status": null,
      "effective_status": "pending",
      "id": "updater-windows",
      "notes": "",
      "overall_gain_if_next_valid_pass": 0.0522,
      "p30_gain_if_next_valid_pass": 1.619,
      "raw_status": "pending",
      "recorded_at": null,
      "requirement": "Windows + updater-helper binary",
      "title": "Updater E2E Windows"
    },
    {
      "certification_path": "release-gate rust-quality",
      "current_runner_notes": null,
      "current_runner_status": null,
      "effective_status": "pending",
      "id": "updater-linux",
      "notes": "",
      "overall_gain_if_next_valid_pass": 0.0522,
      "p30_gain_if_next_valid_pass": 1.619,
      "raw_status": "pending",
      "recorded_at": null,
      "requirement": "Linux + updater-helper binary",
      "title": "Updater E2E Linux"
    },
    {
      "certification_path": "release-gate rust-quality",
      "current_runner_notes": null,
      "current_runner_status": null,
      "effective_status": "pending",
      "id": "updater-macos",
      "notes": "",
      "overall_gain_if_next_valid_pass": 0.0522,
      "p30_gain_if_next_valid_pass": 1.619,
      "raw_status": "pending",
      "recorded_at": null,
      "requirement": "macOS + updater-helper binary",
      "title": "Updater E2E macOS"
    },
    {
      "certification_path": "release-signing",
      "current_runner_notes": null,
      "current_runner_status": null,
      "effective_status": "pending",
      "id": "windows-authenticode",
      "notes": "",
      "overall_gain_if_next_valid_pass": 0.0522,
      "p30_gain_if_next_valid_pass": 1.619,
      "raw_status": "pending",
      "recorded_at": null,
      "requirement": "Windows + SignTool + protected certificate",
      "title": "Windows Authenticode"
    },
    {
      "certification_path": "release-signing",
      "current_runner_notes": null,
      "current_runner_status": null,
      "effective_status": "pending",
      "id": "macos-notarization",
      "notes": "",
      "overall_gain_if_next_valid_pass": 0.0522,
      "p30_gain_if_next_valid_pass": 1.619,
      "raw_status": "pending",
      "recorded_at": null,
      "requirement": "macOS + signing identity + Apple notarization credentials",
      "title": "macOS notarization"
    },
    {
      "certification_path": "security/release gate",
      "current_runner_notes": null,
      "current_runner_status": null,
      "effective_status": "pending",
      "id": "rustsec-audit",
      "notes": "",
      "overall_gain_if_next_valid_pass": 0.0522,
      "p30_gain_if_next_valid_pass": 1.619,
      "raw_status": "pending",
      "recorded_at": null,
      "requirement": "cargo + cargo-audit + dependency index",
      "title": "RustSec audit"
    },
    {
      "certification_path": "security-nightly",
      "current_runner_notes": null,
      "current_runner_status": null,
      "effective_status": "pending",
      "id": "fuzz-remote-protocol",
      "notes": "",
      "overall_gain_if_next_valid_pass": 0.0522,
      "p30_gain_if_next_valid_pass": 1.619,
      "raw_status": "pending",
      "recorded_at": null,
      "requirement": "cargo + cargo-fuzz + fuzz corpus",
      "title": "Remote protocol fuzz"
    },
    {
      "certification_path": "security-nightly",
      "current_runner_notes": null,
      "current_runner_status": null,
      "effective_status": "pending",
      "id": "fuzz-stream-open",
      "notes": "",
      "overall_gain_if_next_valid_pass": 0.0522,
      "p30_gain_if_next_valid_pass": 1.619,
      "raw_status": "pending",
      "recorded_at": null,
      "requirement": "cargo + cargo-fuzz + fuzz corpus",
      "title": "Stream-open fuzz"
    },
    {
      "certification_path": "certify-local / reviewed evidence",
      "current_runner_notes": null,
      "current_runner_status": null,
      "effective_status": "pending",
      "id": "control-load-slo",
      "notes": "",
      "overall_gain_if_next_valid_pass": 0.0522,
      "p30_gain_if_next_valid_pass": 1.619,
      "raw_status": "pending",
      "recorded_at": null,
      "requirement": "live Control Plane target",
      "title": "Control Plane load/SLO"
    },
    {
      "certification_path": "reviewed external evidence",
      "current_runner_notes": null,
      "current_runner_status": null,
      "effective_status": "pending",
      "id": "ha-failover",
      "notes": "",
      "overall_gain_if_next_valid_pass": 0.0522,
      "p30_gain_if_next_valid_pass": 1.619,
      "raw_status": "pending",
      "recorded_at": null,
      "requirement": "multi-node Control Plane + shared PostgreSQL",
      "title": "HA failover"
    },
    {
      "certification_path": "reviewed external evidence",
      "current_runner_notes": null,
      "current_runner_status": null,
      "effective_status": "pending",
      "id": "dr-restore",
      "notes": "",
      "overall_gain_if_next_valid_pass": 0.0522,
      "p30_gain_if_next_valid_pass": 1.619,
      "raw_status": "pending",
      "recorded_at": null,
      "requirement": "source + isolated restore PostgreSQL targets",
      "title": "Disaster-recovery restore"
    },
    {
      "certification_path": "reviewed/local evidence",
      "current_runner_notes": null,
      "current_runner_status": null,
      "effective_status": "pending",
      "id": "vault-key-rotation",
      "notes": "",
      "overall_gain_if_next_valid_pass": 0.0522,
      "p30_gain_if_next_valid_pass": 1.619,
      "raw_status": "pending",
      "recorded_at": null,
      "requirement": "real VSN binaries + isolated test state",
      "title": "Vault rotation E2E"
    },
    {
      "certification_path": "reviewed external evidence",
      "current_runner_notes": null,
      "current_runner_status": null,
      "effective_status": "pending",
      "id": "penetration-test",
      "notes": "",
      "overall_gain_if_next_valid_pass": 0.0522,
      "p30_gain_if_next_valid_pass": 1.619,